{
  "contract_set_version": "1.2.0",
  "document_id": "inv_corpus_easy_03",
  "difficulty": "easy",
  "challenge_tags": [
    "explicit_company_name",
    "ein_present",
    "website_present"
  ],
  "comparison_summary": {
    "applicable_field_count": 13,
    "matched_field_count": 13,
    "mismatched_field_count": 0,
    "missing_prediction_count": 0,
    "unexpected_prediction_count": 0,
    "field_accuracy": 1.0
  },
  "document_pass_fail": {
    "vendor_identity_passed": true,
    "review_routing_passed": true,
    "overall_passed": true
  },
  "field_results": {
    "company_name.value": {
      "expected": "Cedar Freight LLC",
      "actual": "CEDAR FREIGHT LLC",
      "result": "match"
    },
    "company_name.present": {
      "expected": true,
      "actual": true,
      "result": "match"
    },
    "company_name.inferred": {
      "expected": false,
      "actual": false,
      "result": "match"
    },
    "address.street_1": {
      "expected": "300 Pine Rd",
      "actual": "300 Pine Rd",
      "result": "match"
    },
    "address.street_2": {
      "expected": null,
      "actual": null,
      "result": "not_applicable"
    },
    "address.city": {
      "expected": "Denver",
      "actual": "Denver",
      "result": "match"
    },
    "address.state": {
      "expected": "CO",
      "actual": "CO",
      "result": "match"
    },
    "address.postal_code": {
      "expected": "80202",
      "actual": "80202",
      "result": "match"
    },
    "address.country": {
      "expected": "US",
      "actual": "US",
      "result": "match"
    },
    "tax_ids.ein": {
      "expected": "34-5678901",
      "actual": "34-5678901",
      "result": "match"
    },
    "tax_ids.state_tax_id": {
      "expected": null,
      "actual": null,
      "result": "not_applicable"
    },
    "tax_ids.vat_id": {
      "expected": null,
      "actual": null,
      "result": "not_applicable"
    },
    "tax_ids.other_tax_id": {
      "expected": null,
      "actual": null,
      "result": "not_applicable"
    },
    "website": {
      "expected": "https://cedarfreight.example.com",
      "actual": "https://cedarfreight.example.com",
      "result": "match"
    },
    "phone": {
      "expected": "+1 303-555-0120",
      "actual": "+1 303-555-0120",
      "result": "match"
    },
    "email": {
      "expected": "ops@cedarfreight.example.com",
      "actual": "ops@cedarfreight.example.com",
      "result": "match"
    },
    "manual_review_required": {
      "expected": false,
      "actual": false,
      "result": "match"
    },
    "review_reason": {
      "expected": null,
      "actual": null,
      "result": "not_applicable"
    }
  },
  "notes": []
}
