{
  "contract_set_version": "1.2.0",
  "document_id": "inv_corpus_medium_03",
  "difficulty": "medium",
  "challenge_tags": [
    "explicit_company_name",
    "ein_present"
  ],
  "comparison_summary": {
    "applicable_field_count": 13,
    "matched_field_count": 13,
    "mismatched_field_count": 0,
    "missing_prediction_count": 0,
    "unexpected_prediction_count": 0,
    "field_accuracy": 1.0
  },
  "document_pass_fail": {
    "vendor_identity_passed": true,
    "review_routing_passed": true,
    "overall_passed": true
  },
  "field_results": {
    "company_name.value": {
      "expected": "Harbor Metals Inc.",
      "actual": "Harbor Metals Inc.",
      "result": "match"
    },
    "company_name.present": {
      "expected": true,
      "actual": true,
      "result": "match"
    },
    "company_name.inferred": {
      "expected": false,
      "actual": false,
      "result": "match"
    },
    "address.street_1": {
      "expected": "80 Dock Way",
      "actual": "80 Dock Way",
      "result": "match"
    },
    "address.street_2": {
      "expected": null,
      "actual": null,
      "result": "not_applicable"
    },
    "address.city": {
      "expected": "Baltimore",
      "actual": "Baltimore",
      "result": "match"
    },
    "address.state": {
      "expected": "MD",
      "actual": "MD",
      "result": "match"
    },
    "address.postal_code": {
      "expected": "21201",
      "actual": "21201",
      "result": "match"
    },
    "address.country": {
      "expected": "US",
      "actual": "US",
      "result": "match"
    },
    "tax_ids.ein": {
      "expected": "89-0123456",
      "actual": "89-0123456",
      "result": "match"
    },
    "tax_ids.state_tax_id": {
      "expected": null,
      "actual": null,
      "result": "not_applicable"
    },
    "tax_ids.vat_id": {
      "expected": null,
      "actual": null,
      "result": "not_applicable"
    },
    "tax_ids.other_tax_id": {
      "expected": null,
      "actual": null,
      "result": "not_applicable"
    },
    "website": {
      "expected": "https://harbormetals.example.com",
      "actual": "https://harbormetals.example.com",
      "result": "match"
    },
    "phone": {
      "expected": "+1 410-555-0170",
      "actual": "+1 410-555-0170",
      "result": "match"
    },
    "email": {
      "expected": "ap@harbormetals.example.com",
      "actual": "ap@harbormetals.example.com",
      "result": "match"
    },
    "manual_review_required": {
      "expected": false,
      "actual": false,
      "result": "match"
    },
    "review_reason": {
      "expected": null,
      "actual": null,
      "result": "not_applicable"
    }
  },
  "notes": []
}
