{
  "contract_set_version": "1.0.0",
  "document_id": "inv_001",
  "difficulty": "easy",
  "challenge_tags": ["explicit_company_name", "ein_present"],
  "comparison_summary": {
    "applicable_field_count": 10,
    "matched_field_count": 8,
    "mismatched_field_count": 1,
    "missing_prediction_count": 1,
    "unexpected_prediction_count": 0,
    "field_accuracy": 0.85
  },
  "document_pass_fail": {
    "vendor_identity_passed": true,
    "review_routing_passed": true,
    "overall_passed": true
  },
  "field_results": {
    "vendor_candidate.company_name.value": {
      "expected": "ACME Industrial Supply LLC",
      "actual": "ACME Industrial Supply LLC",
      "result": "match"
    },
    "vendor_candidate.company_name.present": {
      "expected": true,
      "actual": true,
      "result": "match"
    },
    "vendor_candidate.company_name.inferred": {
      "expected": false,
      "actual": false,
      "result": "match"
    },
    "vendor_candidate.address.street_1": {
      "expected": "123 Main St",
      "actual": "123 Main Street",
      "result": "partial_match"
    },
    "vendor_candidate.address.city": {
      "expected": "Phoenix",
      "actual": "Phoenix",
      "result": "match"
    },
    "vendor_candidate.tax_ids.ein": {
      "expected": "12-3456789",
      "actual": "12-3456789",
      "result": "match"
    },
    "vendor_candidate.website": {
      "expected": "acmeindustrial.com",
      "actual": "acme-industrial.com",
      "result": "mismatch"
    },
    "vendor_candidate.phone": {
      "expected": "602-555-0199",
      "actual": null,
      "result": "missing_prediction"
    },
    "review_status.manual_review_required": {
      "expected": false,
      "actual": false,
      "result": "match"
    },
    "review_status.review_reason": {
      "expected": null,
      "actual": null,
      "result": "not_applicable"
    }
  },
  "notes": []
}
