{
  "contract_set_version": "1.2.0",
  "document_id": "inv_corpus_hard_01",
  "difficulty": "hard",
  "challenge_tags": [
    "explicit_company_name",
    "ein_present"
  ],
  "comparison_summary": {
    "applicable_field_count": 13,
    "matched_field_count": 13,
    "mismatched_field_count": 0,
    "missing_prediction_count": 0,
    "unexpected_prediction_count": 0,
    "field_accuracy": 1.0
  },
  "document_pass_fail": {
    "vendor_identity_passed": true,
    "review_routing_passed": true,
    "overall_passed": true
  },
  "field_results": {
    "company_name.value": {
      "expected": "Kestrel Engineering, Inc.",
      "actual": "kestrel engineering inc",
      "result": "match"
    },
    "company_name.present": {
      "expected": true,
      "actual": true,
      "result": "match"
    },
    "company_name.inferred": {
      "expected": false,
      "actual": false,
      "result": "match"
    },
    "address.street_1": {
      "expected": "11 Hawk Blvd",
      "actual": "11 Hawk Blvd",
      "result": "match"
    },
    "address.street_2": {
      "expected": null,
      "actual": null,
      "result": "not_applicable"
    },
    "address.city": {
      "expected": "Phoenix",
      "actual": "Phoenix",
      "result": "match"
    },
    "address.state": {
      "expected": "AZ",
      "actual": "AZ",
      "result": "match"
    },
    "address.postal_code": {
      "expected": "85001",
      "actual": "85001",
      "result": "match"
    },
    "address.country": {
      "expected": "US",
      "actual": "US",
      "result": "match"
    },
    "tax_ids.ein": {
      "expected": "11-2233445",
      "actual": "11-2233445",
      "result": "match"
    },
    "tax_ids.state_tax_id": {
      "expected": null,
      "actual": null,
      "result": "not_applicable"
    },
    "tax_ids.vat_id": {
      "expected": null,
      "actual": null,
      "result": "not_applicable"
    },
    "tax_ids.other_tax_id": {
      "expected": null,
      "actual": null,
      "result": "not_applicable"
    },
    "website": {
      "expected": "https://kestrel.example.com",
      "actual": "https://kestrel.example.com",
      "result": "match"
    },
    "phone": {
      "expected": "+1 602-555-0200",
      "actual": "+1 602-555-0200",
      "result": "match"
    },
    "email": {
      "expected": "ap@kestrel.example.com",
      "actual": "ap@kestrel.example.com",
      "result": "match"
    },
    "manual_review_required": {
      "expected": false,
      "actual": false,
      "result": "match"
    },
    "review_reason": {
      "expected": null,
      "actual": null,
      "result": "not_applicable"
    }
  },
  "notes": []
}
