{
  "contract_set_version": "1.2.0",
  "document_id": "inv_corpus_easy_04",
  "difficulty": "easy",
  "challenge_tags": [
    "explicit_company_name",
    "ein_present",
    "website_present"
  ],
  "comparison_summary": {
    "applicable_field_count": 13,
    "matched_field_count": 13,
    "mismatched_field_count": 0,
    "missing_prediction_count": 0,
    "unexpected_prediction_count": 0,
    "field_accuracy": 1.0
  },
  "document_pass_fail": {
    "vendor_identity_passed": true,
    "review_routing_passed": true,
    "overall_passed": true
  },
  "field_results": {
    "company_name.value": {
      "expected": "Delta Parts Corp.",
      "actual": "DELTA PARTS CORP.",
      "result": "match"
    },
    "company_name.present": {
      "expected": true,
      "actual": true,
      "result": "match"
    },
    "company_name.inferred": {
      "expected": false,
      "actual": false,
      "result": "match"
    },
    "address.street_1": {
      "expected": "40 Elm St",
      "actual": "40 Elm St",
      "result": "match"
    },
    "address.street_2": {
      "expected": null,
      "actual": null,
      "result": "not_applicable"
    },
    "address.city": {
      "expected": "Austin",
      "actual": "Austin",
      "result": "match"
    },
    "address.state": {
      "expected": "TX",
      "actual": "TX",
      "result": "match"
    },
    "address.postal_code": {
      "expected": "73301",
      "actual": "73301",
      "result": "match"
    },
    "address.country": {
      "expected": "US",
      "actual": "US",
      "result": "match"
    },
    "tax_ids.ein": {
      "expected": "45-6789012",
      "actual": "45-6789012",
      "result": "match"
    },
    "tax_ids.state_tax_id": {
      "expected": null,
      "actual": null,
      "result": "not_applicable"
    },
    "tax_ids.vat_id": {
      "expected": null,
      "actual": null,
      "result": "not_applicable"
    },
    "tax_ids.other_tax_id": {
      "expected": null,
      "actual": null,
      "result": "not_applicable"
    },
    "website": {
      "expected": "https://deltaparts.example.com",
      "actual": "https://deltaparts.example.com",
      "result": "match"
    },
    "phone": {
      "expected": "+1 512-555-0130",
      "actual": "+1 512-555-0130",
      "result": "match"
    },
    "email": {
      "expected": "invoices@deltaparts.example.com",
      "actual": "invoices@deltaparts.example.com",
      "result": "match"
    },
    "manual_review_required": {
      "expected": false,
      "actual": false,
      "result": "match"
    },
    "review_reason": {
      "expected": null,
      "actual": null,
      "result": "not_applicable"
    }
  },
  "notes": []
}
