{
  "contract_set_version": "1.2.0",
  "document_id": "inv_corpus_medium_01",
  "difficulty": "medium",
  "challenge_tags": [
    "explicit_company_name",
    "ein_present"
  ],
  "comparison_summary": {
    "applicable_field_count": 13,
    "matched_field_count": 12,
    "mismatched_field_count": 0,
    "missing_prediction_count": 1,
    "unexpected_prediction_count": 0,
    "field_accuracy": 0.923077
  },
  "document_pass_fail": {
    "vendor_identity_passed": true,
    "review_routing_passed": true,
    "overall_passed": true
  },
  "field_results": {
    "company_name.value": {
      "expected": "Falcon Logistics Ltd.",
      "actual": "Falcon Logistics Ltd.",
      "result": "match"
    },
    "company_name.present": {
      "expected": true,
      "actual": true,
      "result": "match"
    },
    "company_name.inferred": {
      "expected": false,
      "actual": false,
      "result": "match"
    },
    "address.street_1": {
      "expected": "60 Maple Dr",
      "actual": "60 Maple Dr",
      "result": "match"
    },
    "address.street_2": {
      "expected": null,
      "actual": null,
      "result": "not_applicable"
    },
    "address.city": {
      "expected": "Portland",
      "actual": "Portland",
      "result": "match"
    },
    "address.state": {
      "expected": "OR",
      "actual": "OR",
      "result": "match"
    },
    "address.postal_code": {
      "expected": "97201",
      "actual": "97201",
      "result": "match"
    },
    "address.country": {
      "expected": "US",
      "actual": "US",
      "result": "match"
    },
    "tax_ids.ein": {
      "expected": "67-8901234",
      "actual": "67-8901234",
      "result": "match"
    },
    "tax_ids.state_tax_id": {
      "expected": null,
      "actual": null,
      "result": "not_applicable"
    },
    "tax_ids.vat_id": {
      "expected": null,
      "actual": null,
      "result": "not_applicable"
    },
    "tax_ids.other_tax_id": {
      "expected": null,
      "actual": null,
      "result": "not_applicable"
    },
    "website": {
      "expected": "https://falconlog.example.com",
      "actual": "https://falconlog.example.com",
      "result": "match"
    },
    "phone": {
      "expected": "+1 503-555-0150",
      "actual": "+1 503-555-0150",
      "result": "match"
    },
    "email": {
      "expected": "ap@falconlog.example.com",
      "actual": null,
      "result": "missing_prediction"
    },
    "manual_review_required": {
      "expected": false,
      "actual": false,
      "result": "match"
    },
    "review_reason": {
      "expected": null,
      "actual": null,
      "result": "not_applicable"
    }
  },
  "notes": []
}
